{
  "schemaVersion": 1,
  "category": "Driving schools",
  "slug": "driving-schools",
  "provenance": {
    "generatedBy": "claude-opus-5-5 · Field Kit v2 Prompt A batch",
    "generatedAt": "2026-10-03",
    "reviewStatus": "unreviewed",
    "reviewedBy": null,
    "notes": "Edu family batch. State-licensed; enrolment and behind-the-wheel scheduling are the product. Requirements vary by state, so copy never states hours or ages. Ranges are planning figures, not quotes."
  },
  "pageStructurePlus": [
    {
      "section": "Your state's teen licence steps",
      "contains": "The permit, classroom drivers ed, behind the wheel hours, supervised practice log and road test in order, as the state requires them, with what the driving school covers at each step",
      "why": "Parents of a teen don't know the order of the steps. The driving school that lays them out plainly is the one they trust with the whole path."
    },
    {
      "section": "Behind-the-wheel pickup zones",
      "contains": "Home, high school and workplace pickup areas for behind the wheel lessons, pickup windows by area, the dual-control cars used and what to bring to each drive",
      "why": "Parents can't drive a teen across town for every lesson. Pickup from school or home can decide which driving school a family picks."
    },
    {
      "section": "Road test day package",
      "contains": "Use of the driving school's car for the road test, a warm-up lesson before the test, booking the test slot, what examiners check and what happens if a student fails",
      "why": "Road test day is the most nervous moment of the process. Families pay extra for a familiar car and an instructor on site."
    },
    {
      "section": "Defensive driving and ticket courses",
      "contains": "Court-approved defensive driving and ticket dismissal courses, point reduction where the state allows, online or classroom formats, and the completion certificate",
      "why": "Adults with a ticket search urgently and book whoever explains the court-approved course and certificate fastest."
    },
    {
      "section": "Adult, senior and new-to-country drivers",
      "contains": "Lessons for adults who never learned, seniors refreshing skills, drivers with a foreign licence, highway and parallel parking practice, and lessons in other languages",
      "why": "Adult learners are anxious and specific. A page written for them fills weekday daytime slots teens can't use."
    },
    {
      "section": "Insurance discount certificate",
      "contains": "Which courses produce a certificate the family's insurer may accept for a teen or mature driver discount, how to get it, and how to send it to the insurer",
      "why": "Parents weigh the course price against insurance savings. Explaining the certificate turns the price into an easy decision."
    }
  ],
  "designDirections": [
    {
      "id": "a",
      "themeId": "C6",
      "siteType": "local-conversion",
      "name": "Book a Drive",
      "heroLayout": "split-photo",
      "mood": [
        "clear",
        "dependable",
        "direct"
      ],
      "bestFor": "Single-office driving schools that need drivers ed sign-ups and lesson bookings from parents",
      "pairsWithTier": "starter",
      "headlineSample": "Drivers ed and driving lessons in {City}. Enrol today.",
      "whyItFits": "Cobalt Wire's clean blue and grotesque sans read like an official form done right, and the split hero keeps the enrol button beside a training car."
    },
    {
      "id": "b",
      "themeId": "C26",
      "siteType": "enrolment",
      "name": "Road to Licence",
      "heroLayout": "card-stack",
      "mood": [
        "reassuring",
        "organised",
        "friendly"
      ],
      "bestFor": "Driving schools with teen drivers ed, behind the wheel packages, adult lessons and road test days",
      "pairsWithTier": "standard",
      "headlineSample": "Teen drivers ed and behind the wheel training in {City}",
      "whyItFits": "The family combo. Sky Kite's calm light ground reassures nervous parents, and the card stack walks through the licence steps in order."
    },
    {
      "id": "c",
      "themeId": "C13",
      "siteType": "premium-brand",
      "name": "Road Ready",
      "heroLayout": "full-bleed-photo",
      "mood": [
        "confident",
        "professional",
        "focused"
      ],
      "bestFor": "Established schools selling premium private lessons, road test packages and defensive driving",
      "pairsWithTier": "premium",
      "headlineSample": "Private driving lessons in {City}, from permit to road test",
      "whyItFits": "Obsidian with amber accents recalls night roads and signal lights, and the geometric display gives the school a confident, professional feel."
    }
  ],
  "openers": [
    {
      "angle": "No Website button",
      "line": "Your driving school's Google listing has the office hours but no website, so a parent searching drivers ed in {City} can't see the course dates or how behind the wheel lessons work.",
      "hook": "Open their Maps listing and confirm there is no Website button. Screenshot it for when they reply.",
      "linkLine": "Here's the driving school page behind that button: {demo-link}"
    },
    {
      "angle": "Facebook-only link",
      "line": "The website link for the driving school opens Facebook, where the next drivers ed class start date is a post buried under road safety reminders.",
      "hook": "Tap the link and find the most recent class start post. Note its date.",
      "linkLine": "Drivers ed class dates and enrolment, on one page: {demo-link}"
    },
    {
      "angle": "Dead free host",
      "line": "The driving school site on your listing shows drivers ed class dates that have passed. A parent ready to enrol a teen stops right there.",
      "hook": "Open the site and find one stale detail: past class dates, old prices, a broken enrol form. Note it.",
      "linkLine": "Same driving school, with this season's classes: {demo-link}"
    },
    {
      "angle": "Broken on a phone",
      "line": "I opened your driving school site on my phone and the course table spilled off the screen. Teens and parents look up drivers ed on their phones.",
      "hook": "Only if they have a site. Load it on your phone and note what breaks. Screenshot it for when they reply.",
      "linkLine": "The same driving school, rebuilt for a phone: {demo-link}"
    },
    {
      "angle": "Phone-only enrolment",
      "line": "Enrolling in drivers ed with you means calling during office hours, while your instructors are out in the cars. Online enrolment would take those sign-ups any time.",
      "hook": "Look for an online enrol or payment option. If it's call or walk-in only, the angle holds.",
      "linkLine": "Drivers ed enrolment that works at night: {demo-link}"
    },
    {
      "angle": "New drivers, nowhere to live",
      "line": "Your posts of students who just passed the road test are the best thing on the driving school's page, and they're gone in a week. A road test page would keep them working.",
      "hook": "Find a recent 'passed my test' post and note it. Only use students who were happy to be posted.",
      "linkLine": "Your newly licensed drivers, where parents decide: {demo-link}"
    },
    {
      "angle": "Reviews about calm instructors",
      "line": "Your reviews have parents saying an instructor calmed down a nervous teen driver. That review belongs right beside the behind the wheel booking.",
      "hook": "Read their reviews and copy one phrase about patience, nerves or passing. Quote it if they reply.",
      "linkLine": "Driving school reviews beside the booking: {demo-link}"
    },
    {
      "angle": "Summer and school-break classes",
      "line": "Summer and winter break drivers ed classes fill fast because teens are out of school. The driving schools with dates and online enrolment fill theirs first.",
      "hook": "Use this from March to May for summer and October for winter break. Name the season.",
      "linkLine": "A summer drivers ed page, ready to enrol: {demo-link}"
    },
    {
      "angle": "Ticket deadline at night",
      "line": "Someone with a traffic ticket searches for a defensive driving course the night they get it. Right now the driving school can't enrol them until morning.",
      "hook": "Check whether they offer defensive driving or ticket courses. Note the format.",
      "linkLine": "A defensive driving course page that enrols at 11pm: {demo-link}"
    },
    {
      "angle": "Hiring driving instructors",
      "line": "Saw you're hiring driving instructors. Good candidates check how the school looks online before they go through state instructor licensing with you.",
      "hook": "Only if they posted for instructors. Note the role.",
      "linkLine": "A driving school page with an instructor careers section: {demo-link}"
    },
    {
      "angle": "Pickup area",
      "line": "You pick students up for behind the wheel lessons, but nothing says whether that includes {Neighborhood} or the high schools nearby. Parents check that first.",
      "hook": "Check posts or reviews for pickup mentions. Note the schools or areas named.",
      "linkLine": "A driving lesson page with pickup zones: {demo-link}"
    },
    {
      "angle": "Course prices hidden",
      "line": "I couldn't find a drivers ed or lesson package price anywhere. Parents comparing driving schools tend to start with the one that shows a total.",
      "hook": "Check every page and post for course or lesson prices. If none, the angle holds.",
      "linkLine": "Drivers ed and lesson packages, priced plainly: {demo-link}"
    },
    {
      "angle": "State licence and instructor credentials",
      "line": "Your driving school's state licence and instructor certifications are why a careful parent would choose you, and they're not shown anywhere.",